{
  "content_id": "CP-2026-04-01-AMP-001",
  "source_pipeline": "amplify",
  "source_campaign_id": "CAMP-2026-04-01-001",
  "product": "sahaayak-seva",
  "bucket": "public_services",
  "goal": "Increase AI-driven scheme eligibility checks by 30% through sahaayak-seva chatbots, with 20% reduction in service delivery delays within 6 months",
  "platforms": [
    "linkedin",
    "x",
    "instagram",
    "shorts",
    "discord"
  ],
  "hook": "800M rural citizens in India face systemic delays in accessing welfare\u2014until now",
  "summary": "Sahaayak-Seva's AI chatbots are transforming rural service delivery with real-time updates and multilingual support",
  "platform_content": {
    "linkedin_post": "India's rural population of 800 million faces critical gaps in welfare access due to fragmented service delivery. Sahaayak-Seva's AI chatbots are bridging this gap by automating scheme eligibility checks in regional languages, reducing bureaucratic delays by 20% (Economic Survey 2026). Our pilot programs with state welfare departments show predictive analytics tracking service progress for 60% of rural citizens. This is not just technology\u2014it's a paradigm shift in public service delivery. #AIForGood #PublicServices #DigitalIndia",
    "x_tweet": "800M rural Indians struggle with welfare access. Sahaayak-Seva's AI chatbots cut delays by 20% and automate eligibility checks in regional languages. Ready to transform rural service delivery? \ud83d\ude80 #AI #PublicServices",
    "x_thread": [
      "India's rural population of 800 million faces systemic delays in accessing welfare schemes. Why? Fragmented delivery & poor citizen engagement. \ud83d\udea8",
      "Sahaayak-Seva's AI chatbots are solving this: 30% increase in eligibility checks, 20% faster service delivery. Real-time updates in regional languages? Yes. \ud83d\udcf1",
      "Pilot programs with state departments show predictive analytics tracking service progress. This isn't just tech\u2014it's a governance revolution. \ud83c\udf1f #AIForGood"
    ],
    "instagram_caption": "AI chatbots are transforming rural India's welfare access! \ud83c\udf1f 30% faster eligibility checks, 20% fewer delays. Real-time updates in regional languages. \ud83d\udcac #SahaayakSeva #DigitalIndia #PublicServices",
    "shorts_title": "How AI is transforming rural India's welfare access?",
    "shorts_description": "800M rural citizens face delays in welfare schemes. Sahaayak-Seva's AI chatbots cut delays by 20% with real-time updates in regional languages. \ud83d\ude80 #AI #PublicServices",
    "discord_message": "Did you know 60% of rural Indians lack real-time updates for government services? \ud83d\udea8 Our pilot with state departments shows AI chatbots can cut delays by 20%. Want to discuss how this transforms rural service delivery? Drop your thoughts below! \ud83d\udcac"
  },
  "image_brief": "A multilingual AI chatbot interface with a rural citizen interacting, showing real-time updates in regional languages and a dashboard tracking service progress",
  "video_brief": "A 15-second demo of the Sahaayak-Seva chatbot interface, showing a rural citizen in regional language asking about welfare eligibility and receiving real-time updates",
  "cover_brief": "Thumbnail of a chatbot interface with 'Sahaayak-Seva' logo, showing a rural citizen interacting in regional language with real-time updates",
  "proof_requirements": "Economic Survey 2026 data, sahayak-os framework documentation, pilot program testimonials",
  "cta": "Engage with our campaign to transform rural service delivery through AI-powered public service assistants",
  "restricted_claims": [
    "AI can replace human experts in governance",
    "No need for regional language support",
    "Solutions are universally scalable without adaptation"
  ],
  "status": "draft",
  "approval_level": "L2",
  "created_date": "2026-04-01"
}
